Servine, Grass Snake Pokémon, ジャノビー, Janovy, #0496, https://archives.bulbagarden.net/wiki/Category:Servine, Grass, None, Overgrow, None, Contrary, 60, 60, 75, 60, 75, 83, Reflect-Grass Knot-Sleep Talk-Grassy Glide-Take Down-Grass Pledge-Solar Beam-Leer-Sweet Scent-Rest-Facade-Mirror Coat-Glare-Leaf Blade-Sunny Day-Seed Bomb-Light Screen-Mean Look-Taunt-Trailblaze-Double-Edge-Helping Hand-Synthesis-Leech Seed-Slam-Coil-Bullet Seed-Giga Drain-Calm Mind-Swift-Iron Tail-Growth-Endure-Tackle-Protect-Mega Drain-Leaf Storm-Aerial Ace-Magical Leaf-Swords Dance-Vine Whip-Petal Blizzard-Gastro Acid-Wrap-Twister-Energy Ball-Tera Blast-Knock Off-Grassy Terrain-Substitute, 
Serperior, Regal Pokémon, ジャローダ, Jalorda, #0497, https://archives.bulbagarden.net/wiki/Category:Serperior, Grass, None, Overgrow, None, Contrary, 75, 75, 95, 75, 95, 113, Reflect-Grass Knot-Sleep Talk-Grassy Glide-Take Down-Grass Pledge-Solar Beam-Leer-Outrage-Sweet Scent-Rest-Facade-Scale Shot-Dragon Pulse-Mirror Coat-Glare-Leaf Blade-Sunny Day-Seed Bomb-Light Screen-Mean Look-Taunt-Trailblaze-Double-Edge-Helping Hand-Synthesis-Leech Seed-Slam-Coil-Bullet Seed-Giga Drain-Body Slam-Calm Mind-Swift-Giga Impact-Iron Tail-Breaking Swipe-Growth-Frenzy Plant-Endure-Tackle-Scary Face-Hyper Beam-Protect-Mega Drain-Leaf Storm-Aerial Ace-Magical Leaf-Swords Dance-Vine Whip-Petal Blizzard-Gastro Acid-Wrap-Dragon Tail-Twister-Energy Ball-Tera Blast-Knock Off-Grassy Terrain-Substitute, 
Tepig, Fire Pig Pokémon, ポカブ, Pokabu, #0498, https://archives.bulbagarden.net/wiki/Category:Tepig, Fire, None, Blaze, None, Thick Fat, 65, 63, 45, 45, 45, 45, Flare Blitz-Grass Knot-Sleep Talk-Take Down-Heat Crash-Flamethrower-Heat Wave-Solar Beam-Wild Charge-Rest-Facade-Overheat-Assurance-Sunny Day-Stomping Tantrum-Will-O-Wisp-Head Smash-Fire Blast-Roar-Trailblaze-Taunt-Double-Edge-Zen Headbutt-Helping Hand-Tail Whip-Mud-Slap-Heavy Slam-Body Slam-Curse-Fire Punch-Yawn-Superpower-Fire Pledge-Rock Tomb-Temper Flare-Defense Curl-Endure-Tackle-Flame Charge-Protect-Gyro Ball-Endeavor-Smog-Rollout-Dig-Sucker Punch-Fire Spin-Tera Blast-Thrash-Substitute-Ember, 
Pignite, Fire Pig Pokémon, チャオブー, Chaoboo, #0499, https://archives.bulbagarden.net/wiki/Category:Pignite, Fire, Fighting, Blaze, None, Thick Fat, 90, 93, 55, 70, 55, 55, Flare Blitz-Grass Knot-Fling-Sleep Talk-Take Down-Reversal-Heat Crash-Flamethrower-Heat Wave-Solar Beam-Wild Charge-Rest-Facade-Bulldoze-Overheat-Assurance-Sunny Day-Stomping Tantrum-Will-O-Wisp-Head Smash-Fire Blast-Roar-Trailblaze-Drain Punch-Taunt-Stone Edge-Zen Headbutt-Helping Hand-Close Combat-Tail Whip-Double-Edge-Mud-Slap-Heavy Slam-Low Sweep-Body Slam-Curse-Fire Punch-Yawn-Superpower-Focus Blast-Bulk Up-Fire Pledge-Coaching-Rock Tomb-Brick Break-Defense Curl-Endure-Tackle-Scary Face-Flame Charge-Protect-Thunder Punch-Gyro Ball-Temper Flare-Rock Slide-High Horsepower-Endeavor-Smog-Rollout-Dig-Arm Thrust-Sucker Punch-Poison Jab-Fire Spin-Tera Blast-Low Kick-Knock Off-Thrash-Focus Punch-Substitute-Ember, 
Emboar, Mega Fire Pig Pokémon, エンブオー, Enbuoh, #0500, https://archives.bulbagarden.net/wiki/Category:Emboar, Fire, Fighting, Blaze, None, Reckless, 110, 123, 65, 100, 65, 65, Flare Blitz-Facade-Overheat-Sunny Day-Scald-Stomping Tantrum-Smack Down-Roar-Double-Edge-Zen Headbutt-Yawn-Coaching-Endure-Thunder Punch-Gyro Ball-Blast Burn-Endeavor-Rollout-Dig-Arm Thrust-Poison Jab-Fire Spin-Low Kick-Fire Pledge-Ember-Sleep Talk-Reversal-Wild Charge-Will-O-Wisp-Head Smash-Fire Blast-Close Combat-Helping Hand-Tail Whip-Heavy Slam-Low Sweep-Body Slam-Temper Flare-Defense Curl-Tackle-Thrash-Substitute-Hammer Arm-Fling-Take Down-Heat Crash-Solar Beam-Taunt-Stone Edge-Mud-Slap-Curse-Superpower-Protect-High Horsepower-Smog-Sucker Punch-Tera Blast-Knock Off-Bulk Up-Hard Press-Grass Knot-Flamethrower-Heat Wave-Rest-Bulldoze-Assurance-Drain Punch-Trailblaze-Fire Punch-Giga Impact-Focus Blast-Rock Tomb-Brick Break-Body Press-Scary Face-Hyper Beam-Flame Charge-Iron Head-Rock Slide-Earthquake-Focus Punch, 
Oshawott, Sea Otter Pokémon, ミジュマル, Mijumaru, #0501, https://archives.bulbagarden.net/wiki/Category:Oshawott, Water, None, Torrent, None, Shell Armor, 55, 55, 45, 63, 45, 45, Avalanche-Grass Knot-Fling-Sleep Talk-Take Down-Razor Shell-Flip Turn-Night Slash-Tera Blast-Detect-Snowscape-Facade-Rest-Screech-Focus Energy-Icy Wind-Rain Dance-Taunt-Ice Beam-Helping Hand-Tail Whip-Waterfall-Copycat-Water Pledge-Water Pulse-Swift-Encore-Endure-Tackle-Water Gun-Retaliate-Aqua Tail-Protect-Air Slash-Aqua Cutter-Aerial Ace-Swords Dance-Chilling Water-X-Scissor-Blizzard-Surf-Soak-Whirlpool-False Swipe-Dig-Fury Cutter-Sacred Sword-Thief-Knock Off-Liquidation-Aqua Jet-Substitute-Hydro Pump, 
Dewott, Discipline Pokémon, フタチマル, Futachimaru, #0502, https://archives.bulbagarden.net/wiki/Category:Dewott, Water, None, Torrent, None, Shell Armor, 75, 75, 60, 83, 60, 60, Avalanche-Grass Knot-Fling-Sleep Talk-Take Down-Razor Shell-Flip Turn-Night Slash-Tera Blast-Detect-Snowscape-Facade-Rest-Vacuum Wave-Screech-Focus Energy-Icy Wind-Rain Dance-Taunt-Ice Beam-Helping Hand-Tail Whip-Waterfall-Copycat-Water Pledge-Water Pulse-Swift-Brick Break-Encore-Endure-Tackle-Water Gun-Retaliate-Aqua Tail-Protect-Air Slash-Aqua Cutter-Aerial Ace-Swords Dance-Chilling Water-X-Scissor-Blizzard-Surf-Soak-Whirlpool-False Swipe-Dig-Fury Cutter-Sacred Sword-Thief-Knock Off-Liquidation-Aqua Jet-Substitute-Hydro Pump, 
Samurott, Formidable Pokémon, ダイケンキ, Daikenki, #0503, https://archives.bulbagarden.net/wiki/Category:Samurott, Water, None, Torrent, None, Shell Armor, 95, 100, 85, 108, 70, 70, Avalanche-Grass Knot-Fling-Sleep Talk-Take Down-Megahorn-Razor Shell-Flip Turn-Night Slash-Tera Blast-Detect-Snowscape-Facade-Bulldoze-Rest-Hydro Cannon-Vacuum Wave-Screech-Focus Energy-Icy Wind-Rain Dance-Taunt-Ice Beam-Helping Hand-Tail Whip-Waterfall-Copycat-Body Slam-Water Pledge-Water Pulse-Swift-Giga Impact-Aqua Cutter-Brick Break-Encore-Endure-Tackle-Water Gun-Retaliate-Aqua Tail-Scary Face-Protect-Air Slash-Hyper Beam-Aerial Ace-Swords Dance-Chilling Water-X-Scissor-Blizzard-Drill Run-Upper Hand-Surf-Soak-Whirlpool-Smart Strike-False Swipe-Dig-Slash-Fury Cutter-Sacred Sword-Thief-Knock Off-Liquidation-Aqua Jet-Substitute-Hydro Pump, 
Patrat, Scout Pokémon, ミネズミ, Minezumi, #0504, https://archives.bulbagarden.net/wiki/Category:Patrat, Normal, None, Run Away, Keen Eye, Analytic, 45, 55, 39, 35, 39, 42, Grass Knot-Fling-Sleep Talk-Leer-Toxic-Detect-Rest-Facade-Sand Attack-Work Up-Assurance-Screech-Sunny Day-Seed Bomb-Crunch-Mean Look-Focus Energy-Swagger-Rain Dance-Baton Pass-Helping Hand-Zen Headbutt-Slam-Return-Thunderbolt-Nasty Plot-Bullet Seed-Shadow Ball-Bite-Iron Tail-Confide-Last Resort-Secret Power-Revenge-Covet-Laser Focus-Snore-Cut-Tackle-Retaliate-Protect-Aqua Tail-Tearful Look-Shock Wave-Swords Dance-Flail-Super Fang-Hypnosis-After You-Hyper Fang-Foresight-Endeavor-Gunk Shot-Double Team-Dig-Frustration-Attract-Bide-Hidden Power-Low Kick-Round-Pursuit-Substitute, 
Watchog, Lookout Pokémon, ミルホッグ, Miruhog, #0505, https://archives.bulbagarden.net/wiki/Category:Watchog, Normal, None, Illuminate, Keen Eye, Analytic, 60, 85, 69, 60, 69, 77, Dream Eater-Toxic-Detect-Facade-Sunny Day-Stomping Tantrum-Light Screen-Focus Energy-Rain Dance-Zen Headbutt-Bullet Seed-Covet-Snore-Confuse Ray-Retaliate-Thunder Punch-Tearful Look-Psych Up-Hyper Fang-Endeavor-Double Team-Dig-Frustration-Bide-Low Kick-Round-Sleep Talk-Sand Attack-Screech-Seed Bomb-Crunch-Mean Look-Baton Pass-Helping Hand-Confide-Last Resort-Laser Focus-Tackle-Swords Dance-Hypnosis-Gunk Shot-Thunder Wave-Power-Up Punch-Substitute-Fling-Leer-Strength-Thunder-Swagger-Slam-Return-Thunderbolt-Bite-Iron Tail-Rock Smash-Protect-Aqua Tail-Shock Wave-Flail-Super Fang-After You-Knock Off-Pursuit-Grass Knot-Flamethrower-Rest-Work Up-Assurance-Nasty Plot-Rototiller-Shadow Ball-Fire Punch-Giga Impact-Focus Blast-Secret Power-Revenge-Cut-Hyper Beam-Foresight-Flash-Signal Beam-Attract-Hidden Power-Focus Punch-Ice Punch, 
Lillipup, Puppy Pokémon, ヨーテリー, Yorterrie, #0506, https://archives.bulbagarden.net/wiki/Category:Lillipup, Normal, None, Vital Spirit, Pickup, Run Away, 45, 60, 45, 25, 45, 55, Sleep Talk-Take Down-Reversal-Leer-Toxic-Play Rough-Wild Charge-Rest-Facade-Work Up-Uproar-Sand Attack-Sunny Day-Crunch-Swagger-Rain Dance-Roar-Hyper Voice-Ice Fang-Helping Hand-Return-Thunderbolt-Mud-Slap-Charm-Shadow Ball-Howl-Bite-Yawn-Giga Impact-Confide-Last Resort-Secret Power-Fire Fang-Covet-Snore-Rock Tomb-Endure-Retaliate-Tackle-Lick-Protect-Rock Smash-Snarl-Shock Wave-Aerial Ace-After You-Thunder Wave-Psychic Fangs-Double Team-Baby-Doll Eyes-Dig-Payback-Thunder Fang-Frustration-Attract-Hidden Power-Odor Sleuth-Round-Pursuit-Substitute, 
Herdier, Loyal Dog Pokémon, ハーデリア, Herderrie, #0507, https://archives.bulbagarden.net/wiki/Category:Herdier, Normal, None, Intimidate, Sand Rush, Scrappy, 65, 80, 65, 35, 65, 60, Sleep Talk-Take Down-Reversal-Leer-Toxic-Play Rough-Wild Charge-Rest-Facade-Work Up-Uproar-Sand Attack-Strength-Sunny Day-Crunch-Swagger-Rain Dance-Roar-Hyper Voice-Ice Fang-Helping Hand-Return-Thunderbolt-Mud-Slap-Charm-Shadow Ball-Howl-Bite-Yawn-Giga Impact-Confide-Last Resort-Secret Power-Fire Fang-Covet-Snore-Rock Tomb-Endure-Retaliate-Tackle-Lick-Protect-Rock Smash-Snarl-Shock Wave-Aerial Ace-After You-Surf-Thunder Wave-Psychic Fangs-Double Team-Baby-Doll Eyes-Dig-Payback-Thunder Fang-Frustration-Attract-Hidden Power-Odor Sleuth-Round-Pursuit-Substitute, 
Stoutland, Big-Hearted Pokémon, ムーランド, Mooland, #0508, https://archives.bulbagarden.net/wiki/Category:Stoutland, Normal, None, Intimidate, Sand Rush, Scrappy, 85, 110, 90, 45, 90, 80, Sleep Talk-Take Down-Reversal-Leer-Toxic-Play Rough-Wild Charge-Rest-Facade-Work Up-Uproar-Sand Attack-Strength-Sunny Day-Thunder-Stomping Tantrum-Crunch-Swagger-Rain Dance-Roar-Hyper Voice-Ice Fang-Helping Hand-Return-Thunderbolt-Mud-Slap-Charm-Shadow Ball-Howl-Bite-Yawn-Giga Impact-Superpower-Confide-Last Resort-Secret Power-Fire Fang-Covet-Snore-Rock Tomb-Endure-Tackle-Retaliate-Hyper Beam-Protect-Iron Head-Snarl-Lick-Rock Smash-Aerial Ace-Shock Wave-After You-Surf-Thunder Wave-Psychic Fangs-Double Team-Baby-Doll Eyes-Dig-Payback-Thunder Fang-Frustration-Attract-Hidden Power-Odor Sleuth-Round-Pursuit-Substitute, 
Purrloin, Devious Pokémon, チョロネコ, Choroneko, #0509, https://archives.bulbagarden.net/wiki/Category:Purrloin, Dark, None, Limber, Unburden, Prankster, 41, 50, 37, 50, 37, 66, Dream Eater-Grass Knot-Sleep Talk-Night Slash-Toxic-Play Rough-Rest-Facade-Snatch-Sand Attack-Assurance-Screech-Embargo-Sunny Day-Seed Bomb-Captivate-Fake Tears-Swagger-Scratch-Rain Dance-Taunt-Hyper Voice-Baton Pass-Spite-U-turn-Return-Nasty Plot-Charm-Copycat-Shadow Ball-Hone Claws-Pay Day-Swift-Yawn-Iron Tail-Confide-Dark Pulse-Fake Out-Secret Power-Foul Play-Covet-Quick Attack-Snore-Encore-Lash Out-Endure-Cut-Feint Attack-Protect-Shadow Claw-Snarl-Echoed Voice-Aerial Ace-Psych Up-Assist-Trick-Gunk Shot-Fury Swipes-Thunder Wave-Growl-Double Team-Torment-Sucker Punch-Payback-Slash-Frustration-Attract-Hidden Power-Thief-Knock Off-Role Play-Round-Pursuit-Substitute, 
Liepard, Cruel Pokémon, レパルダス, Lepardas, #0510, https://archives.bulbagarden.net/wiki/Category:Liepard, Dark, None, Limber, Unburden, Prankster, 64, 88, 50, 88, 50, 106, Dream Eater-Night Slash-Toxic-Facade-Sunny Day-Rain Dance-Charm-Copycat-Yawn-Covet-Snore-Endure-Shadow Claw-Aerial Ace-Psych Up-Growl-Double Team-Frustration-Round-Foul Play-Sleep Talk-Sand Attack-Screech-Seed Bomb-Scratch-Baton Pass-Spite-Swift-Psycho Cut-Confide-Laser Focus-Encore-Feint Attack-Snarl-Gunk Shot-Fury Swipes-Thunder Wave-Captivate-Substitute-Fake Tears-Swagger-Taunt-U-turn-Return-Hone Claws-Pay Day-Iron Tail-Fake Out-Quick Attack-Lash Out-Rock Smash-Protect-Assist-Sucker Punch-Slash-Thief-Knock Off-Role Play-Pursuit-Grass Knot-Burning Jealousy-Skitter Smack-Play Rough-Rest-Snatch-Assurance-Embargo-Hyper Voice-Throat Chop-Nasty Plot-Shadow Ball-Giga Impact-Dark Pulse-Secret Power-Cut-Hyper Beam-Echoed Voice-Trick-Torment-Payback-Attract-Hidden Power, 
Pansage, Grass Monkey Pokémon, ヤナップ, Yanappu, #0511, https://archives.bulbagarden.net/wiki/Category:Pansage, Grass, None, Gluttony, None, Overgrow, 50, 53, 48, 53, 48, 64, Natural Gift-Grass Knot-Fling-Sleep Talk-Grass Pledge-Worry Seed-Solar Beam-Leer-Toxic-Spiky Shield-Rest-Facade-Work Up-Uproar-Sunny Day-Seed Bomb-Crunch-Scratch-Swagger-Astonish-Taunt-Helping Hand-Grass Whistle-Synthesis-Leech Seed-Return-Bullet Seed-Recycle-Nasty Plot-Disarming Voice-Giga Drain-Low Sweep-Hone Claws-Bite-Iron Tail-Confide-Play Nice-Secret Power-Covet-Rock Tomb-Snore-Cut-Tickle-Rock Smash-Lick-Nature Power-Protect-Shadow Claw-Leaf Storm-Magical Leaf-Vine Whip-Endeavor-Fury Swipes-Gunk Shot-Gastro Acid-Flash-Double Team-Focus Punch-Torment-Payback-Dig-Acrobatics-Frustration-Attract-Energy Ball-Hidden Power-Thief-Low Kick-Knock Off-Role Play-Round-Substitute, 
Simisage, Thorn Monkey Pokémon, ヤナッキー, Yanakkie, #0512, https://archives.bulbagarden.net/wiki/Category:Simisage, Grass, None, Gluttony, None, Overgrow, 75, 98, 63, 98, 63, 101, Worry Seed-Toxic-Facade-Sunny Day-Bullet Seed-Leech Seed-Covet-Snore-Tickle-Shadow Claw-Leaf Storm-Endeavor-Gastro Acid-Double Team-Dig-Acrobatics-Frustration-Low Kick-Round-Natural Gift-Sleep Talk-Grass Pledge-Spiky Shield-Uproar-Seed Bomb-Crunch-Astonish-Scratch-Helping Hand-Grass Whistle-Synthesis-Low Sweep-Confide-Lick-Nature Power-Magical Leaf-Gunk Shot-Fury Swipes-Power-Up Punch-Energy Ball-Substitute-Fling-Solar Beam-Leer-Swagger-Taunt-Return-Disarming Voice-Hone Claws-Bite-Iron Tail-Superpower-Play Nice-Rock Smash-Protect-Vine Whip-Thief-Knock Off-Role Play-Grass Knot-Rest-Work Up-Throat Chop-Nasty Plot-Recycle-Giga Drain-Giga Impact-Focus Blast-Secret Power-Brick Break-Rock Tomb-Cut-Hyper Beam-Rock Slide-Flash-Torment-Payback-Attract-Hidden Power-Focus Punch, 
Pansear, High Temp Pokémon, バオップ, Baoppu, #0513, https://archives.bulbagarden.net/wiki/Category:Pansear, Fire, None, Gluttony, None, Blaze, 50, 53, 48, 53, 48, 64, Natural Gift-Flame Burst-Grass Knot-Fling-Sleep Talk-Flare Blitz-Flamethrower-Solar Beam-Leer-Toxic-Heat Wave-Rest-Facade-Work Up-Overheat-Uproar-Sunny Day-Crunch-Scratch-Fire Blast-Will-O-Wisp-Swagger-Taunt-Astonish-Helping Hand-Return-Recycle-Nasty Plot-Disarming Voice-Low Sweep-Hone Claws-Yawn-Bite-Fire Punch-Confide-Iron Tail-Play Nice-Secret Power-Covet-Fire Pledge-Rock Tomb-Snore-Cut-Tickle-Rock Smash-Lick-Flame Charge-Protect-Shadow Claw-Low Kick-Endeavor-Fury Swipes-Gunk Shot-Gastro Acid-Amnesia-Double Team-Focus Punch-Torment-Incinerate-Payback-Dig-Acrobatics-Frustration-Attract-Hidden Power-Thief-Fire Spin-Knock Off-Role Play-Round-Belch-Substitute, 
Simisear, Ember Pokémon, バオッキー, Baokkie, #0514, https://archives.bulbagarden.net/wiki/Category:Simisear, Fire, None, Gluttony, None, Blaze, 75, 98, 63, 98, 63, 101, Flare Blitz-Toxic-Facade-Overheat-Sunny Day-Yawn-Covet-Snore-Tickle-Shadow Claw-Endeavor-Gastro Acid-Amnesia-Double Team-Incinerate-Dig-Acrobatics-Frustration-Fire Spin-Low Kick-Round-Belch-Fire Pledge-Natural Gift-Flame Burst-Sleep Talk-Uproar-Will-O-Wisp-Astonish-Fire Blast-Scratch-Crunch-Helping Hand-Low Sweep-Confide-Lick-Gunk Shot-Fury Swipes-Power-Up Punch-Substitute-Fling-Solar Beam-Leer-Swagger-Taunt-Return-Disarming Voice-Hone Claws-Bite-Iron Tail-Superpower-Play Nice-Rock Smash-Protect-Thief-Knock Off-Role Play-Grass Knot-Flamethrower-Heat Wave-Rest-Work Up-Throat Chop-Nasty Plot-Recycle-Fire Punch-Giga Impact-Focus Blast-Secret Power-Brick Break-Rock Tomb-Cut-Hyper Beam-Flame Charge-Rock Slide-Torment-Payback-Attract-Hidden Power-Focus Punch, 
Panpour, Spray Pokémon, ヒヤップ, Hiyappu, #0515, https://archives.bulbagarden.net/wiki/Category:Panpour, Water, None, Gluttony, None, Torrent, 50, 53, 48, 53, 48, 64, Natural Gift-Grass Knot-Fling-Sleep Talk-Leer-Toxic-Aqua Ring-Rest-Facade-Work Up-Uproar-Scald-Crunch-Scratch-Swagger-Astonish-Rain Dance-Taunt-Ice Beam-Mud Sport-Icy Wind-Helping Hand-Brine-Return-Recycle-Nasty Plot-Disarming Voice-Waterfall-Low Sweep-Hone Claws-Hail-Water Pledge-Bite-Water Pulse-Iron Tail-Confide-Play Nice-Dive-Secret Power-Covet-Rock Tomb-Snore-Cut-Tickle-Rock Smash-Water Gun-Lick-Protect-Aqua Tail-Shadow Claw-Blizzard-Water Sport-Fury Swipes-Surf-Endeavor-Gastro Acid-Gunk Shot-Double Team-Focus Punch-Torment-Payback-Dig-Acrobatics-Frustration-Attract-Hidden Power-Thief-Low Kick-Knock Off-Role Play-Round-Ice Punch-Substitute-Hydro Pump, 
Simipour, Geyser Pokémon, ヒヤッキー, Hiyakkie, #0516, https://archives.bulbagarden.net/wiki/Category:Simipour, Water, None, Gluttony, None, Torrent, 75, 98, 63, 98, 63, 101, Toxic-Aqua Ring-Facade-Scald-Rain Dance-Waterfall-Water Pledge-Covet-Snore-Tickle-Shadow Claw-Endeavor-Gastro Acid-Double Team-Dig-Acrobatics-Frustration-Low Kick-Round-Natural Gift-Sleep Talk-Uproar-Crunch-Astonish-Scratch-Mud Sport-Ice Beam-Helping Hand-Brine-Low Sweep-Confide-Dive-Lick-Water Gun-Gunk Shot-Fury Swipes-Power-Up Punch-Substitute-Fling-Leer-Swagger-Icy Wind-Taunt-Return-Disarming Voice-Hone Claws-Hail-Water Pulse-Bite-Iron Tail-Superpower-Play Nice-Rock Smash-Protect-Aqua Tail-Thief-Knock Off-Role Play-Hydro Pump-Grass Knot-Rest-Work Up-Throat Chop-Nasty Plot-Recycle-Giga Impact-Focus Blast-Secret Power-Brick Break-Rock Tomb-Cut-Hyper Beam-Blizzard-Rock Slide-Water Sport-Surf-Torment-Payback-Attract-Hidden Power-Focus Punch-Ice Punch, 
Munna, Dream Eater Pokémon, ムンナ, Munna, #0517, https://archives.bulbagarden.net/wiki/Category:Munna, Psychic, None, Forewarn, Synchronize, Telepathy, 76, 25, 45, 67, 55, 24, Dream Eater-Reflect-Sleep Talk-Magic Coat-Worry Seed-Toxic-Moonblast-Rest-Facade-Heal Bell-Expanding Force-Imprison-Guard Swap-Psychic-Psyshock-Light Screen-Swagger-Healing Wish-Rain Dance-Baton Pass-Zen Headbutt-Wonder Room-Helping Hand-Trick Room-Ally Switch-Dazzling Gleam-Return-Psybeam-Shadow Ball-Calm Mind-Safeguard-Moonlight-Yawn-Swift-Curse-Confide-Gravity-Secret Power-Telekinesis-Psywave-Snore-Rock Tomb-Defense Curl-Endure-Charge Beam-Lucky Chant-Gyro Ball-Stored Power-Protect-Nightmare-Shock Wave-Psych Up-Synchronoise-Rock Slide-Hypnosis-Trick-After You-Barrier-Thunder Wave-Amnesia-Power Swap-Skill Swap-Future Sight-Double Team-Flash-Pain Split-Signal Beam-Torment-Frustration-Attract-Energy Ball-Hidden Power-Sonic Boom-Round-Substitute, 
Musharna, Drowsing Pokémon, ムシャーナ, Musharna, #0518, https://archives.bulbagarden.net/wiki/Category:Musharna, Psychic, None, Forewarn, Synchronize, Telepathy, 116, 55, 85, 107, 95, 29, Dream Eater-Worry Seed-Toxic-Moonblast-Facade-Expanding Force-Psychic-Misty Explosion-Light Screen-Rain Dance-Zen Headbutt-Dazzling Gleam-Yawn-Snore-Endure-Gyro Ball-Nightmare-Psych Up-Amnesia-Skill Swap-Double Team-Pain Split-Frustration-Round-Sleep Talk-Healing Wish-Baton Pass-Helping Hand-Trick Room-Ally Switch-Psybeam-Moonlight-Safeguard-Swift-Confide-Psywave-Defense Curl-Lucky Chant-Synchronoise-Hypnosis-Thunder Wave-Power Swap-Energy Ball-Sonic Boom-Substitute-Imprison-Guard Swap-Swagger-Wonder Room-Return-Curse-Gravity-Telekinesis-Stored Power-Protect-Shock Wave-After You-Barrier-Future Sight-Reflect-Magic Coat-Rest-Heal Bell-Psyshock-Shadow Ball-Calm Mind-Giga Impact-Secret Power-Rock Tomb-Charge Beam-Hyper Beam-Rock Slide-Trick-Flash-Torment-Signal Beam-Psychic Terrain-Attract-Hidden Power, 
Pidove, Tiny Pigeon Pokémon, マメパト, Mamepato, #0519, https://archives.bulbagarden.net/wiki/Category:Pidove, Normal, Flying, Big Pecks, Super Luck, Rivalry, 50, 55, 50, 36, 30, 43, Sleep Talk-Heat Wave-Night Slash-Leer-Dual Wingbeat-Toxic-Detect-Rest-Facade-Uproar-Work Up-Tailwind-Sunny Day-Wish-Swagger-Focus Energy-Rain Dance-Taunt-U-turn-Roost-Return-Bestow-Razor Wind-Agility-Swift-Confide-Air Cutter-Secret Power-Quick Attack-Snore-Pluck-Endure-Lucky Chant-Air Slash-Protect-Echoed Voice-Aerial Ace-Substitute-Hypnosis-Sky Attack-Growl-Double Team-Steel Wing-Frustration-Fly-Attract-Hidden Power-Defog-Round-Feather Dance-Gust-Morning Sun, 
Tranquill, Wild Pigeon Pokémon, ハトーボー, Hatoboh, #0520, https://archives.bulbagarden.net/wiki/Category:Tranquill, Normal, Flying, Big Pecks, Super Luck, Rivalry, 62, 77, 62, 50, 42, 65, Sleep Talk-Heat Wave-Night Slash-Leer-Dual Wingbeat-Toxic-Detect-Rest-Facade-Uproar-Work Up-Tailwind-Sunny Day-Wish-Swagger-Focus Energy-Rain Dance-Taunt-U-turn-Roost-Return-Bestow-Razor Wind-Agility-Swift-Confide-Air Cutter-Secret Power-Quick Attack-Snore-Pluck-Endure-Lucky Chant-Air Slash-Protect-Echoed Voice-Aerial Ace-Substitute-Hypnosis-Sky Attack-Growl-Double Team-Steel Wing-Frustration-Fly-Attract-Hidden Power-Defog-Round-Feather Dance-Gust-Morning Sun, 
Unfezant, Proud Pokémon, ケンホロウ, Kenhallow, #0521, https://archives.bulbagarden.net/wiki/Category:Unfezant, Normal, Flying, Big Pecks, Super Luck, Rivalry, 80, 115, 80, 65, 55, 93, Sleep Talk-Heat Wave-Night Slash-Leer-Dual Wingbeat-Toxic-Detect-Rest-Facade-Uproar-Work Up-Tailwind-Sunny Day-Wish-Swagger-Focus Energy-Rain Dance-Taunt-U-turn-Roost-Return-Bestow-Razor Wind-Agility-Swift-Giga Impact-Confide-Hurricane-Air Cutter-Secret Power-Quick Attack-Snore-Pluck-Endure-Hyper Beam-Lucky Chant-Air Slash-Protect-Echoed Voice-Aerial Ace-Psych Up-Substitute-Hypnosis-Sky Attack-Brave Bird-Growl-Double Team-Steel Wing-Frustration-Fly-Attract-Hidden Power-Defog-Round-Feather Dance-Gust-Morning Sun, 
Blitzle, Electrified Pokémon, シママ, Shimama, #0522, https://archives.bulbagarden.net/wiki/Category:Blitzle, Electric, None, Lightning Rod, Motor Drive, Sap Sipper, 45, 60, 32, 50, 32, 76, Double Kick-Sleep Talk-Take Down-Eerie Impulse-Feint-Tera Blast-Wild Charge-Rest-Facade-Uproar-Sand Attack-Screech-Volt Switch-Sunny Day-Thunder-Light Screen-Rain Dance-Trailblaze-Double-Edge-Baton Pass-Helping Hand-Spark-Tail Whip-Thunderbolt-Body Slam-Agility-Swift-Electroweb-Supercell Slam-Quick Attack-Electro Ball-Charge Beam-Endure-Flame Charge-Protect-Shock Wave-Electric Terrain-Discharge-Endeavor-Thunder Wave-Charge-Smart Strike-Thrash-Stomp-Low Kick-Substitute, 
Zebstrika, Thunderbolt Pokémon, ゼブライカ, Zebraika, #0523, https://archives.bulbagarden.net/wiki/Category:Zebstrika, Electric, None, Lightning Rod, Motor Drive, Sap Sipper, 75, 100, 63, 80, 63, 116, Double Kick-Sleep Talk-Take Down-Eerie Impulse-Feint-Tera Blast-Wild Charge-Rest-Facade-Bulldoze-Overheat-Uproar-Sand Attack-Screech-Volt Switch-Sunny Day-Thunder-Light Screen-Rain Dance-Taunt-Trailblaze-Roar-Baton Pass-Double-Edge-Helping Hand-Spark-Tail Whip-Thunderbolt-Body Slam-Agility-Swift-Giga Impact-Electroweb-Supercell Slam-Quick Attack-Electro Ball-Charge Beam-Endure-Hyper Beam-Flame Charge-Protect-Shock Wave-Electric Terrain-Discharge-High Horsepower-Endeavor-Thunder Wave-Charge-Smart Strike-Thrash-Stomp-Low Kick-Substitute, 
Roggenrola, Mantle Pokémon, ダンゴロ, Dangoro, #0524, https://archives.bulbagarden.net/wiki/Category:Roggenrola, Rock, None, Sturdy, Weak Armor, Sand Force, 55, 75, 85, 25, 25, 15, Stealth Rock-Sleep Talk-Take Down-Toxic-Wide Guard-Rest-Facade-Bulldoze-Sand Attack-Strength-Explosion-Sandstorm-Iron Defense-Swagger-Smack Down-Earth Power-Harden-Stone Edge-Return-Mud-Slap-Heavy Slam-Curse-Gravity-Confide-Sand Tomb-Block-Secret Power-Snore-Rock Tomb-Flash Cannon-Endure-Tackle-Body Press-Autotomize-Protect-Nature Power-Rock Smash-Rock Slide-Headbutt-Double Team-Rock Blast-Meteor Beam-Earthquake-Magnitude-Lock-On-Frustration-Attract-Hidden Power-Rock Polish-Round-Substitute, 
Boldore, Ore Pokémon, ガントル, Gantle, #0525, https://archives.bulbagarden.net/wiki/Category:Boldore, Rock, None, Sturdy, Weak Armor, Sand Force, 70, 105, 105, 50, 40, 20, Stealth Rock-Sleep Talk-Take Down-Toxic-Wide Guard-Rest-Facade-Bulldoze-Sand Attack-Strength-Explosion-Sandstorm-Iron Defense-Stomping Tantrum-Swagger-Smack Down-Earth Power-Harden-Stone Edge-Return-Mud-Slap-Heavy Slam-Curse-Gravity-Confide-Sand Tomb-Block-Secret Power-Snore-Rock Tomb-Flash Cannon-Endure-Tackle-Body Press-Autotomize-Protect-Nature Power-Rock Smash-Rock Slide-Headbutt-Power Gem-Double Team-Rock Blast-Meteor Beam-Earthquake-Magnitude-Lock-On-Frustration-Attract-Hidden Power-Rock Polish-Round-Substitute, 
Gigalith, Compressed Pokémon, ギガイアス, Gigaiath, #0526, https://archives.bulbagarden.net/wiki/Category:Gigalith, Rock, None, Sturdy, Sand Stream, Sand Force, 85, 135, 130, 60, 80, 25, Stealth Rock-Sleep Talk-Take Down-Solar Beam-Toxic-Wide Guard-Rest-Facade-Bulldoze-Sand Attack-Strength-Explosion-Sandstorm-Iron Defense-Stomping Tantrum-Swagger-Smack Down-Self-Destruct-Earth Power-Throat Chop-Harden-Stone Edge-Return-Mud-Slap-Heavy Slam-Weather Ball-Curse-Giga Impact-Superpower-Gravity-Confide-Sand Tomb-Block-Secret Power-Laser Focus-Snore-Rock Tomb-Flash Cannon-Endure-Tackle-Hyper Beam-Iron Head-Protect-Body Press-Autotomize-Nature Power-Rock Smash-Rock Slide-Headbutt-Power Gem-Double Team-Rock Blast-Meteor Beam-Earthquake-Magnitude-Lock-On-Frustration-Attract-Hidden Power-Rock Polish-Round-Substitute, 
