Rowlet, Grass Quill Pokémon, モクロー, Mokuroh, #0722, https://archives.bulbagarden.net/wiki/Category:Rowlet, Grass, Flying, Overgrow, None, Long Reach, 68, 55, 55, 50, 50, 42, Grass Knot-Sleep Talk-Grassy Glide-Take Down-Grass Pledge-Solar Beam-Dual Wingbeat-Rest-Facade-Leaf Blade-Sunny Day-Seed Bomb-Light Screen-Astonish-Peck-Rain Dance-Grassy Terrain-Trailblaze-Helping Hand-Synthesis-Bullet Seed-Roost-Nasty Plot-Night Shade-Defog-Giga Drain-Swift-Air Cutter-Haze-Razor Leaf-Pluck-Tackle-Confuse Ray-Endure-Protect-Air Slash-Shadow Claw-Aerial Ace-Swords Dance-Magical Leaf-Leaf Storm-Brave Bird-Shadow Sneak-Growl-Double Team-Sucker Punch-False Swipe-Energy Ball-Tera Blast-Knock Off-Leafage-Feather Dance-Substitute, 
Dartrix, Blade Quill Pokémon, フクスロー, Fukuthrow, #0723, https://archives.bulbagarden.net/wiki/Category:Dartrix, Grass, Flying, Overgrow, None, Long Reach, 78, 75, 75, 70, 70, 52, Grass Knot-Sleep Talk-Grassy Glide-Take Down-Grass Pledge-Solar Beam-Dual Wingbeat-Rest-Facade-Tailwind-Leaf Blade-Sunny Day-Seed Bomb-Light Screen-Astonish-Peck-Rain Dance-Grassy Terrain-Trailblaze-Baton Pass-Helping Hand-Synthesis-Bullet Seed-Roost-Nasty Plot-Night Shade-Defog-Giga Drain-Swift-Air Cutter-Haze-Razor Leaf-Pluck-Tackle-Confuse Ray-Endure-Protect-Air Slash-Shadow Claw-Aerial Ace-Swords Dance-Magical Leaf-Leaf Storm-Brave Bird-Shadow Sneak-Growl-Double Team-Sucker Punch-False Swipe-Energy Ball-Tera Blast-Knock Off-Leafage-Feather Dance-Substitute, 
Decidueye, Arrow Quill Pokémon, ジュナイパー, Junaiper, #0724, https://archives.bulbagarden.net/wiki/Category:Decidueye, Grass, Ghost, Overgrow, None, Long Reach, 78, 107, 75, 100, 100, 70, Grass Knot-Sleep Talk-Grassy Glide-Take Down-Grass Pledge-Skitter Smack-Solar Beam-Dual Wingbeat-Phantom Force-Rest-Facade-Tailwind-Leaf Blade-Sunny Day-Seed Bomb-Imprison-Light Screen-Astonish-Smack Down-Peck-Rain Dance-Grassy Terrain-Trailblaze-Baton Pass-Helping Hand-Spite-U-turn-Synthesis-Bullet Seed-Poltergeist-Nasty Plot-Night Shade-Defog-Giga Drain-Roost-Low Sweep-Shadow Ball-Curse-Swift-Giga Impact-Hurricane-Air Cutter-Frenzy Plant-Haze-Razor Leaf-Pluck-Tackle-Confuse Ray-Endure-Spirit Shackle-Protect-Shadow Claw-Air Slash-Hyper Beam-Leaf Storm-Aerial Ace-Magical Leaf-Swords Dance-Brave Bird-Shadow Sneak-Growl-Double Team-Sucker Punch-False Swipe-Acrobatics-Hex-Energy Ball-Solar Blade-Tera Blast-Low Kick-Knock Off-Leafage-Feather Dance-Substitute, 
Litten, Fire Cat Pokémon, ニャビー, Nyabby, #0725, https://archives.bulbagarden.net/wiki/Category:Litten, Fire, None, Blaze, None, Intimidate, 45, 65, 40, 60, 40, 70, Double Kick-Flare Blitz-Sleep Talk-Take Down-Flamethrower-Heat Wave-Outrage-Tera Blast-Rest-Facade-Overheat-Sunny Day-Swagger-Scratch-Will-O-Wisp-Crunch-Fire Blast-Roar-Trailblaze-Taunt-Double-Edge-Helping Hand-U-turn-Nasty Plot-Body Slam-Bite-Fake Out-Bulk Up-Fire Fang-Fire Pledge-Temper Flare-Endure-Scary Face-Lick-Flame Charge-Protect-Power Trip-Shadow Claw-Swords Dance-Leech Life-Endeavor-Fury Swipes-Growl-Parting Shot-Acrobatics-Thrash-Fire Spin-Substitute-Ember, 
Torracat, Fire Cat Pokémon, ニャヒート, Nyaheat, #0726, https://archives.bulbagarden.net/wiki/Category:Torracat, Fire, None, Blaze, None, Intimidate, 65, 85, 50, 80, 50, 90, Double Kick-Flare Blitz-Sleep Talk-Take Down-Flamethrower-Heat Wave-Outrage-Tera Blast-Rest-Facade-Overheat-Sunny Day-Swagger-Scratch-Will-O-Wisp-Crunch-Fire Blast-Roar-Trailblaze-Taunt-Double-Edge-Helping Hand-U-turn-Nasty Plot-Body Slam-Bite-Fake Out-Bulk Up-Fire Fang-Fire Pledge-Temper Flare-Endure-Scary Face-Lick-Flame Charge-Protect-Power Trip-Shadow Claw-Swords Dance-Leech Life-Endeavor-Fury Swipes-Growl-Parting Shot-Acrobatics-Thrash-Fire Spin-Substitute-Ember, 
Incineroar, Heel Pokémon, ガオガエン, Gaogaen, #0727, https://archives.bulbagarden.net/wiki/Category:Incineroar, Fire, Dark, Blaze, None, Intimidate, 95, 115, 90, 80, 90, 60, Flare Blitz-Facade-Overheat-Sunny Day-Stomping Tantrum-Roar-Double-Edge-Endure-Thunder Punch-Shadow Claw-Aerial Ace-Blast Burn-Cross Chop-Endeavor-Growl-Acrobatics-Fire Spin-Low Kick-Fire Pledge-Ember-Double Kick-Sleep Talk-Reversal-Outrage-Will-O-Wisp-Scratch-Crunch-Fire Blast-Close Combat-Baton Pass-Helping Hand-Low Sweep-Body Slam-Temper Flare-Lick-Power Trip-Snarl-Scorching Sands-Swords Dance-Fury Swipes-Parting Shot-Thrash-Substitute-Fling-Take Down-Heat Crash-Swagger-Taunt-U-turn-Bite-Fake Out-Fire Fang-Lash Out-Protect-Tera Blast-Thief-Knock Off-Bulk Up-Burning Jealousy-Flamethrower-Heat Wave-Rest-Bulldoze-Drain Punch-Trailblaze-Throat Chop-Nasty Plot-Fire Punch-Giga Impact-Dark Pulse-Focus Blast-Brick Break-Scary Face-Hyper Beam-Flame Charge-Iron Head-Darkest Lariat-Earthquake-Focus Punch-Leech Life, 
Popplio, Sea Lion Pokémon, アシマリ, Ashimari, #0728, https://archives.bulbagarden.net/wiki/Category:Popplio, Water, None, Torrent, None, Liquid Voice, 50, 54, 54, 66, 56, 40, Sleep Talk-Sing-Flip Turn-Moonblast-Play Rough-Aqua Ring-Rest-Facade-Uproar-Life Dew-Ice Spinner-Icy Wind-Hyper Voice-Rain Dance-Ice Beam-Helping Hand-Misty Terrain-Disarming Voice-Charm-Waterfall-Water Pledge-Water Pulse-Swift-Pound-Triple Axel-Bubble Beam-Encore-Endure-Water Gun-Protect-Chilling Water-Blizzard-Surf-Amnesia-Growl-Baby-Doll Eyes-Whirlpool-Perish Song-Acrobatics-Tera Blast-Aqua Jet-Substitute-Draining Kiss-Hydro Pump, 
Brionne, Pop Star Pokémon, オシャマリ, Osyamari, #0729, https://archives.bulbagarden.net/wiki/Category:Brionne, Water, None, Torrent, None, Liquid Voice, 60, 69, 69, 91, 81, 50, Sleep Talk-Sing-Flip Turn-Moonblast-Play Rough-Aqua Ring-Rest-Facade-Uproar-Life Dew-Ice Spinner-Icy Wind-Hyper Voice-Rain Dance-Ice Beam-Helping Hand-Misty Terrain-Disarming Voice-Charm-Waterfall-Body Slam-Water Pledge-Water Pulse-Swift-Pound-Triple Axel-Bubble Beam-Encore-Endure-Water Gun-Protect-Chilling Water-Blizzard-Surf-Amnesia-Growl-Baby-Doll Eyes-Whirlpool-Perish Song-Acrobatics-Tera Blast-Aqua Jet-Substitute-Draining Kiss-Hydro Pump, 
Primarina, Soloist Pokémon, アシレーヌ, Ashirene, #0730, https://archives.bulbagarden.net/wiki/Category:Primarina, Water, Fairy, Torrent, None, Liquid Voice, 80, 74, 74, 126, 116, 60, Reflect-Sleep Talk-Sparkling Aria-Sing-Flip Turn-Moonblast-Play Rough-Aqua Ring-Alluring Voice-Snowscape-Facade-Rest-Uproar-Hydro Cannon-Psychic-Misty Explosion-Light Screen-Ice Spinner-Life Dew-Icy Wind-Hyper Voice-Rain Dance-Ice Beam-Helping Hand-Dazzling Gleam-Misty Terrain-Disarming Voice-Charm-Waterfall-Body Slam-Shadow Ball-Weather Ball-Calm Mind-Water Pledge-Water Pulse-Swift-Giga Impact-Pound-Haze-Triple Axel-Bubble Beam-Encore-Endure-Water Gun-Hyper Beam-Protect-Stored Power-Psych Up-Chilling Water-Blizzard-Surf-Amnesia-Growl-Baby-Doll Eyes-Whirlpool-Perish Song-Acrobatics-Energy Ball-Psychic Noise-Tera Blast-Liquidation-Aqua Jet-Substitute-Draining Kiss-Hydro Pump, 
Pikipek, Woodpecker Pokémon, ツツケラ, Tsutsukera, #0731, https://archives.bulbagarden.net/wiki/Category:Pikipek, Normal, Flying, Keen Eye, Skill Link, Pickup, 35, 75, 30, 30, 30, 65, Sleep Talk-Take Down-Heat Wave-Fury Attack-Dual Wingbeat-Tera Blast-Rest-Facade-Uproar-Screech-Tailwind-Sunny Day-Smack Down-Supersonic-Peck-Hyper Voice-Helping Hand-U-turn-Roost-Bullet Seed-Air Cutter-Brick Break-Pluck-Endure-Rock Smash-Boomburst-Flame Charge-Protect-Air Slash-Echoed Voice-Aerial Ace-Swords Dance-Sky Attack-Brave Bird-Gunk Shot-Endeavor-Growl-Drill Peck-Acrobatics-Fly-Thief-Knock Off-Feather Dance-Substitute, 
Trumbeak, Bugle Beak Pokémon, ケララッパ, Kerarappa, #0732, https://archives.bulbagarden.net/wiki/Category:Trumbeak, Normal, Flying, Keen Eye, Skill Link, Pickup, 55, 85, 50, 40, 50, 75, Sleep Talk-Take Down-Heat Wave-Fury Attack-Dual Wingbeat-Tera Blast-Rest-Facade-Uproar-Screech-Tailwind-Sunny Day-Smack Down-Peck-Supersonic-Hyper Voice-Helping Hand-U-turn-Roost-Bullet Seed-Swift-Air Cutter-Brick Break-Pluck-Endure-Rock Smash-Boomburst-Flame Charge-Protect-Air Slash-Echoed Voice-Aerial Ace-Swords Dance-Sky Attack-Brave Bird-Gunk Shot-Endeavor-Growl-Rock Blast-Drill Peck-Acrobatics-Fly-Thief-Knock Off-Feather Dance-Substitute, 
Toucannon, Cannon Pokémon, ドデカバシ, Dodekabashi, #0733, https://archives.bulbagarden.net/wiki/Category:Toucannon, Normal, Flying, Keen Eye, Skill Link, Sheer Force, 80, 120, 75, 75, 75, 60, Sleep Talk-Take Down-Heat Wave-Fury Attack-Dual Wingbeat-Tera Blast-Rest-Facade-Overheat-Uproar-Screech-Tailwind-Sunny Day-Seed Bomb-Smack Down-Peck-Supersonic-Hyper Voice-Throat Chop-Helping Hand-U-turn-Roost-Bullet Seed-Boomburst-Swift-Giga Impact-Hurricane-Air Cutter-Brick Break-Encore-Pluck-Endure-Rock Smash-Scary Face-Flame Charge-Protect-Air Slash-Echoed Voice-Beak Blast-Flash Cannon-Aerial Ace-Swords Dance-Hyper Beam-Psych Up-Temper Flare-Sky Attack-Brave Bird-Gunk Shot-Endeavor-Growl-Rock Blast-Drill Peck-Acrobatics-Fly-Thief-Knock Off-Feather Dance-Substitute, 
Yungoos, Loitering Pokémon, ヤングース, Youngoose, #0734, https://archives.bulbagarden.net/wiki/Category:Yungoos, Normal, None, Stakeout, Strong Jaw, Adaptability, 48, 70, 30, 30, 30, 45, Sleep Talk-Take Down-Reversal-Leer-Tera Blast-Wild Charge-Rest-Facade-Bulldoze-Sand Attack-Work Up-Sandstorm-Sunny Day-Seed Bomb-Stomping Tantrum-Crunch-Mud Shot-Rain Dance-Taunt-Trailblaze-Double-Edge-Ice Fang-Zen Headbutt-Helping Hand-U-turn-Mud-Slap-Yawn-Bite-Last Resort-Fire Fang-Rock Tomb-Endure-Tackle-Scary Face-Protect-Chilling Water-Super Fang-Endeavor-Psychic Fangs-Payback-Dig-Thunder Fang-Thrash-Thief-Substitute, 
Gumshoos, Stakeout Pokémon, デカグース, Dekagoose, #0735, https://archives.bulbagarden.net/wiki/Category:Gumshoos, Normal, None, Stakeout, Strong Jaw, Adaptability, 88, 110, 60, 55, 60, 45, Fling-Sleep Talk-Take Down-Reversal-Leer-Tera Blast-Wild Charge-Rest-Facade-Bulldoze-Sand Attack-Work Up-Sandstorm-Sunny Day-Seed Bomb-Stomping Tantrum-Crunch-Mud Shot-Rain Dance-Taunt-Trailblaze-Roar-Double-Edge-Ice Fang-Zen Headbutt-Helping Hand-U-turn-Mud-Slap-Low Sweep-Body Slam-Curse-Yawn-Bite-Fire Punch-Giga Impact-Last Resort-Fire Fang-Rock Tomb-Endure-Tackle-Scary Face-Thunder Punch-Protect-Iron Head-Hyper Beam-Chilling Water-Super Fang-Endeavor-Psychic Fangs-Payback-Dig-Earthquake-Thunder Fang-Thrash-Thief-Knock Off-Focus Punch-Ice Punch-Substitute, 
Grubbin, Larva Pokémon, アゴジムシ, Agojimushi, #0736, https://archives.bulbagarden.net/wiki/Category:Grubbin, Bug, None, Swarm, None, None, 47, 62, 45, 55, 45, 46, Sleep Talk-Take Down-Skitter Smack-Pounce-Vise Grip-Rest-Facade-Wild Charge-Bug Bite-Volt Switch-String Shot-Crunch-Mud Shot-Light Screen-Rain Dance-Baton Pass-Harden-Spark-Mud-Slap-Thunderbolt-Bite-Electroweb-Lunge-Charge Beam-Endure-Struggle Bug-Sticky Web-Protect-X-Scissor-Electric Terrain-Discharge-Thunder Wave-Charge-Dig-Poison Jab-Tera Blast-Substitute, 
Charjabug, Battery Pokémon, デンヂムシ, Dendimushi, #0737, https://archives.bulbagarden.net/wiki/Category:Charjabug, Bug, Electric, Battery, None, None, 57, 82, 95, 55, 75, 36, Sleep Talk-Take Down-Eerie Impulse-Skitter Smack-Pounce-Vise Grip-Rest-Facade-Wild Charge-Bug Bite-String Shot-Iron Defense-Volt Switch-Thunder-Crunch-Mud Shot-Light Screen-Rain Dance-Baton Pass-Harden-Spark-Mud-Slap-Thunderbolt-Bite-Electroweb-Lunge-Electro Ball-Charge Beam-Endure-Struggle Bug-Sticky Web-Protect-X-Scissor-Electric Terrain-Discharge-Thunder Wave-Charge-Dig-Poison Jab-Tera Blast-Substitute, 
Vikavolt, Stag Beetle Pokémon, クワガノン, Kuwagannon, #0738, https://archives.bulbagarden.net/wiki/Category:Vikavolt, Bug, Electric, Levitate, None, None, 77, 70, 90, 145, 75, 43, Sleep Talk-Take Down-Eerie Impulse-Skitter Smack-Pounce-Solar Beam-Vise Grip-Rest-Facade-Bulldoze-Bug Buzz-Wild Charge-Bug Bite-String Shot-Iron Defense-Volt Switch-Thunder-Crunch-Mud Shot-Light Screen-Rain Dance-Baton Pass-Harden-Spark-Mud-Slap-Thunderbolt-Agility-Bite-Swift-Giga Impact-Electroweb-Supercell Slam-Lunge-Electro Ball-Charge Beam-Endure-Struggle Bug-Sticky Web-Flash Cannon-Protect-Air Slash-Hyper Beam-X-Scissor-Electric Terrain-Discharge-Zap Cannon-Thunder Wave-Charge-Dig-Acrobatics-Poison Jab-Fly-Energy Ball-Tera Blast-Guillotine-Substitute, 
Crabrawler, Boxing Pokémon, マケンカニ, Makenkani, #0739, https://archives.bulbagarden.net/wiki/Category:Crabrawler, Fighting, None, Hyper Cutter, Iron Fist, Anger Point, 47, 82, 57, 42, 47, 63, Fling-Sleep Talk-Reversal-Take Down-Leer-Tera Blast-Vise Grip-Rest-Facade-Bulldoze-Wide Guard-Sunny Day-Iron Defense-Stomping Tantrum-Mud Shot-Rain Dance-Drain Punch-Close Combat-Zen Headbutt-Helping Hand-Slam-Mud-Slap-Body Slam-Swift-Crabhammer-Superpower-Focus Blast-Coaching-Bubble Beam-Brick Break-Rock Tomb-Endure-Rock Smash-Upper Hand-Thunder Punch-Protect-Iron Head-Chilling Water-Dynamic Punch-Rock Slide-Gunk Shot-Endeavor-Amnesia-Payback-Dig-Earthquake-Thief-Knock Off-Liquidation-Focus Punch-Ice Punch-Substitute-Bulk Up, 
Crabominable, Woolly Crab Pokémon, ケケンカニ, Kekenkani, #0740, https://archives.bulbagarden.net/wiki/Category:Crabominable, Fighting, Ice, Hyper Cutter, Iron Fist, Anger Point, 97, 132, 77, 62, 67, 43, Hard Press-Avalanche-Fling-Sleep Talk-Reversal-Take Down-Leer-Tera Blast-Wide Guard-Snowscape-Facade-Bulldoze-Rest-Vise Grip-Sunny Day-Iron Defense-Stomping Tantrum-Ice Spinner-Mud Shot-Icy Wind-Rain Dance-Drain Punch-Close Combat-Ice Beam-Zen Headbutt-Helping Hand-Slam-Mud-Slap-Body Slam-Swift-Giga Impact-Superpower-Focus Blast-Crabhammer-Ice Hammer-Coaching-Bubble Beam-Brick Break-Rock Tomb-Endure-Rock Smash-Scary Face-Thunder Punch-Protect-Body Press-Iron Head-Hyper Beam-Upper Hand-Chilling Water-Blizzard-Dynamic Punch-Rock Slide-Gunk Shot-Endeavor-Amnesia-Dig-Earthquake-Payback-Thief-Knock Off-Liquidation-Focus Punch-Ice Punch-Substitute-Bulk Up, 
Oricorio, Dancing Pokémon, オドリドリ, Odoridori, #0741, https://archives.bulbagarden.net/wiki/Category:Oricorio, Fire, Flying, Dancer, None, None, 75, 70, 70, 98, 70, 93, Teeter Dance-Sleep Talk-Revelation Dance-Take Down-Reversal-Dual Wingbeat-Alluring Voice-Rest-Facade-Sandstorm-Tailwind-Sunny Day-Peck-Icy Wind-Rain Dance-Trailblaze-Taunt-Baton Pass-Helping Hand-U-turn-Roost-Defog-Charm-Agility-Calm Mind-Swift-Safeguard-Hurricane-Pound-Quiver Dance-Air Cutter-Pluck-Endure-Air Slash-Protect-Aerial Ace-Swords Dance-Psych Up-Growl-Acrobatics-Fly-Attract-Tera Blast-Flatter-Feather Dance-Substitute, 
Cutiefly, Bee Fly Pokémon, アブリー, Abuly, #0742, https://archives.bulbagarden.net/wiki/Category:Cutiefly, Bug, Fairy, Honey Gather, Shield Dust, Sweet Veil, 40, 45, 40, 55, 40, 84, Pollen Puff-Reflect-Grass Knot-Sleep Talk-Aromatic Mist-Skitter Smack-Pounce-Play Rough-Moonblast-Tera Blast-Rest-Facade-Bug Buzz-Bug Bite-Tailwind-Sunny Day-Absorb-Imprison-Fake Tears-Light Screen-Psychic-Trailblaze-Stun Spore-Baton Pass-Helping Hand-Fairy Wind-Dazzling Gleam-U-turn-Charm-Calm Mind-Swift-Quiver Dance-Covet-Endure-Struggle Bug-Sticky Web-Protect-Psych Up-Leech Life-Magical Leaf-Substitute-Trick-Skill Swap-Acrobatics-Switcheroo-Energy Ball-Thief-Sweet Scent-Draining Kiss, 
Ribombee, Bee Fly Pokémon, アブリボン, Aburibbon, #0743, https://archives.bulbagarden.net/wiki/Category:Ribombee, Bug, Fairy, Honey Gather, Shield Dust, Sweet Veil, 60, 55, 60, 95, 70, 124, Pollen Puff-Reflect-Grass Knot-Sleep Talk-Aromatic Mist-Take Down-Skitter Smack-Pounce-Solar Beam-Dual Wingbeat-Play Rough-Moonblast-Tera Blast-Alluring Voice-Rest-Facade-Bug Buzz-Bug Bite-Tailwind-Sunny Day-Absorb-Imprison-Fake Tears-Light Screen-Psychic-Trailblaze-Stun Spore-Baton Pass-Helping Hand-Fairy Wind-Dazzling Gleam-U-turn-Charm-Agility-Calm Mind-Swift-Giga Impact-Quiver Dance-Covet-Lunge-Endure-Struggle Bug-Hyper Beam-Sticky Web-Protect-Stored Power-Psych Up-Leech Life-Magical Leaf-Substitute-Trick-Skill Swap-Acrobatics-Switcheroo-Energy Ball-Psychic Noise-Thief-Sweet Scent-Draining Kiss, 
Rockruff, Puppy Pokémon, イワンコ, Iwanko, #0744, https://archives.bulbagarden.net/wiki/Category:Rockruff, Rock, None, Keen Eye, Vital Spirit, Steadfast, 45, 65, 40, 30, 40, 60, Stealth Rock-Sleep Talk-Take Down-Leer-Play Rough-Rest-Facade-Bulldoze-Sand Attack-Sandstorm-Iron Defense-Stomping Tantrum-Crunch-Hyper Voice-Roar-Trailblaze-Taunt-Stone Edge-Earth Power-Zen Headbutt-Helping Hand-Double-Edge-Mud-Slap-Charm-Body Slam-Howl-Bite-Last Resort-Fire Fang-Rock Tomb-Rock Throw-Endure-Tackle-Scary Face-Iron Head-Protect-Snarl-Swords Dance-Rock Slide-Endeavor-Psychic Fangs-Double Team-Dig-Thunder Fang-Thrash-Tera Blast-Substitute, 
Lycanroc, Wolf Pokémon, ルガルガン, Lugarugan, #0745, https://archives.bulbagarden.net/wiki/Category:Lycanroc, Rock, None, Keen Eye, Sand Rush, Steadfast, 75, 115, 65, 55, 65, 112, Last Resort-Endeavor-Thrash, 
Wishiwashi, Small Fry Pokémon, ヨワシ, Yowashi, #0746, https://archives.bulbagarden.net/wiki/Category:Wishiwashi, Water, None, Schooling, None, None, 45, 20, 20, 25, 25, 40, Sleep Talk-Take Down-Flip Turn-Toxic-Aqua Ring-Rest-Facade-Bulldoze-Uproar-Scale Shot-Scald-Swagger-Mud Shot-Rain Dance-Ice Beam-Double-Edge-Helping Hand-U-turn-Brine-Return-Waterfall-Hail-Muddy Water-Water Pulse-Iron Tail-Confide-Dive-Covet-Snore-Endure-Feint Attack-Beat Up-Water Gun-Aqua Tail-Protect-Tearful Look-Mist-Endeavor-Water Sport-Surf-Soak-Growl-Double Team-Whirlpool-Earthquake-Frustration-Attract-Hidden Power-Liquidation-Round-Substitute-Hydro Pump, 
Mareanie, Brutal Star Pokémon, ヒドイデ, Hidoide, #0747, https://archives.bulbagarden.net/wiki/Category:Mareanie, Poison, Water, Merciless, Limber, Regenerator, 50, 53, 62, 43, 52, 45, Acid Spray-Sleep Talk-Pounce-Toxic-Wide Guard-Tera Blast-Rest-Facade-Iron Defense-Ice Spinner-Mud Shot-Peck-Icy Wind-Rain Dance-Ice Beam-Toxic Spikes-Sludge Wave-Muddy Water-Water Pulse-Bite-Haze-Swallow-Spit Up-Lunge-Recover-Sludge Bomb-Endure-Protect-Stockpile-Chilling Water-Blizzard-Substitute-Infestation-Pin Missile-Gunk Shot-Surf-Pain Split-Poison Jab-Poison Sting-Liquidation-Venoshock-Hydro Pump, 
Toxapex, Brutal Star Pokémon, ドヒドイデ, Dohidoide, #0748, https://archives.bulbagarden.net/wiki/Category:Toxapex, Poison, Water, Merciless, Limber, Regenerator, 50, 63, 152, 53, 142, 35, Acid Spray-Sleep Talk-Pounce-Toxic-Wide Guard-Tera Blast-Rest-Facade-Iron Defense-Ice Spinner-Mud Shot-Smack Down-Peck-Icy Wind-Rain Dance-Ice Beam-Toxic Spikes-Baneful Bunker-Body Slam-Sludge Wave-Muddy Water-Water Pulse-Bite-Giga Impact-Haze-Swallow-Spit Up-Lunge-Recover-Sludge Bomb-Endure-Scary Face-Hyper Beam-Protect-Stockpile-Chilling Water-Blizzard-Substitute-Infestation-Pin Missile-Gunk Shot-Surf-Pain Split-Poison Jab-Hex-Poison Sting-Liquidation-Venoshock-Hydro Pump, 
Mudbray, Donkey Pokémon, ドロバンコ, Dorobanko, #0749, https://archives.bulbagarden.net/wiki/Category:Mudbray, Ground, None, Own Tempo, Stamina, Inner Focus, 70, 100, 70, 45, 55, 45, Double Kick-Sleep Talk-Stealth Rock-Take Down-Tera Blast-Rest-Bulldoze-Mega Kick-Facade-Fissure-Strength-Sandstorm-Sunny Day-Iron Defense-Stomping Tantrum-Smack Down-Earth Power-Roar-Close Combat-Double-Edge-Stone Edge-Mud-Slap-Heavy Slam-Low Sweep-Body Slam-Curse-Superpower-Sand Tomb-Rock Tomb-Endure-Rock Smash-Iron Head-Protect-Rock Slide-High Horsepower-Endeavor-Earthquake-Stomp-Low Kick-Counter-Substitute, 
Mudsdale, Draft Horse Pokémon, バンバドロ, Banbadoro, #0750, https://archives.bulbagarden.net/wiki/Category:Mudsdale, Ground, None, Own Tempo, Stamina, Inner Focus, 100, 125, 100, 55, 85, 35, Double Kick-Sleep Talk-Stealth Rock-Take Down-Tera Blast-Rest-Bulldoze-Mega Kick-Facade-Fissure-Strength-Sandstorm-Sunny Day-Iron Defense-Stomping Tantrum-Mud Shot-Smack Down-Earth Power-Roar-Close Combat-Double-Edge-Stone Edge-Mud-Slap-Heavy Slam-Low Sweep-Body Slam-Curse-Giga Impact-Superpower-Focus Blast-Sand Tomb-Rock Tomb-Body Press-Lash Out-Endure-Rock Smash-Scary Face-Iron Head-Protect-Hyper Beam-Rock Slide-High Horsepower-Endeavor-Earthquake-Stomp-Low Kick-Counter-Substitute, 
Dewpider, Water Bubble Pokémon, シズクモ, Shizukumo, #0751, https://archives.bulbagarden.net/wiki/Category:Dewpider, Water, Bug, Water Bubble, None, Water Absorb, 38, 40, 52, 40, 72, 27, Sleep Talk-Skitter Smack-Pounce-Aqua Ring-Rest-Facade-Power Split-Bug Buzz-Mirror Coat-Bug Bite-Iron Defense-Crunch-Icy Wind-Rain Dance-Trailblaze-Ice Beam-Waterfall-Giga Drain-Entrainment-Water Pulse-Bite-Spit Up-Lunge-Bubble Beam-Endure-Water Gun-Sticky Web-Protect-Stockpile-Chilling Water-X-Scissor-Headbutt-Blizzard-Infestation-Endeavor-Surf-Soak-Poison Jab-Tera Blast-Liquidation-Substitute-Leech Life-Hydro Pump, 
Araquanid, Water Bubble Pokémon, オニシズクモ, Onishizukumo, #0752, https://archives.bulbagarden.net/wiki/Category:Araquanid, Water, Bug, Water Bubble, None, Water Absorb, 68, 70, 92, 50, 132, 42, Reflect-Sleep Talk-Skitter Smack-Pounce-Aqua Ring-Wide Guard-Rest-Facade-Power Split-Bug Buzz-Mirror Coat-Bug Bite-Iron Defense-Crunch-Icy Wind-Rain Dance-Trailblaze-Ice Beam-Waterfall-Giga Drain-Body Slam-Entrainment-Water Pulse-Bite-Giga Impact-Spit Up-Lunge-Bubble Beam-Endure-Scary Face-Water Gun-Hyper Beam-Protect-Sticky Web-Stockpile-Chilling Water-X-Scissor-Headbutt-Blizzard-Infestation-Endeavor-Surf-Soak-Poison Jab-Tera Blast-Liquidation-Substitute-Leech Life-Hydro Pump, 
Fomantis, Sickle Grass Pokémon, カリキリ, Karikiri, #0753, https://archives.bulbagarden.net/wiki/Category:Fomantis, Grass, None, Leaf Guard, None, Contrary, 40, 55, 35, 50, 35, 35, Grass Knot-Fling-Sleep Talk-Take Down-Grassy Glide-Skitter Smack-Solar Beam-Worry Seed-Rest-Facade-Bug Bite-Sunny Day-Leaf Blade-Seed Bomb-Trailblaze-Synthesis-Bullet Seed-Defog-Weather Ball-Giga Drain-Superpower-Growth-Razor Leaf-Endure-Protect-Swords Dance-X-Scissor-Magical Leaf-Leaf Storm-Substitute-Petal Blizzard-False Swipe-Slash-Ingrain-Fury Cutter-Energy Ball-Tera Blast-Leafage-Grassy Terrain-Sweet Scent-Leech Life, 
Lurantis, Bloom Sickle Pokémon, ラランテス, Lalantes, #0754, https://archives.bulbagarden.net/wiki/Category:Lurantis, Grass, None, Leaf Guard, None, Contrary, 70, 105, 90, 80, 90, 45, Pollen Puff-Grass Knot-Fling-Sleep Talk-Take Down-Grassy Glide-Skitter Smack-Night Slash-Solar Beam-Worry Seed-Rest-Facade-Bug Bite-Sunny Day-Leaf Blade-Seed Bomb-Rain Dance-Trailblaze-Synthesis-Bullet Seed-Defog-Weather Ball-Giga Drain-Low Sweep-Giga Impact-Superpower-Growth-Brick Break-Razor Leaf-Endure-Scary Face-Hyper Beam-Protect-Swords Dance-X-Scissor-Magical Leaf-Leaf Storm-Substitute-Petal Blizzard-False Swipe-Slash-Ingrain-Fury Cutter-Poison Jab-Energy Ball-Solar Blade-Tera Blast-Knock Off-Leafage-Grassy Terrain-Sweet Scent-Leech Life, 
Morelull, Illuminating Pokémon, ネマシュ, Nemasyu, #0755, https://archives.bulbagarden.net/wiki/Category:Morelull, Grass, Fairy, Illuminate, Effect Spore, Rain Dish, 40, 35, 55, 65, 75, 15, Pollen Puff-Dream Eater-Strength Sap-Sleep Talk-Grass Knot-Magic Coat-Solar Beam-Toxic-Worry Seed-Moonblast-Rest-Facade-Sunny Day-Absorb-Seed Bomb-Poison Powder-Light Screen-Astonish-Swagger-Stun Spore-Wonder Room-Dazzling Gleam-Magic Room-Leech Seed-Return-Recycle-Synthesis-Sleep Powder-Giga Drain-Spotlight-Safeguard-Moonlight-Spore-Confide-Growth-Snore-Sludge Bomb-Confuse Ray-Endure-Nature Power-Protect-Mega Drain-After You-Thunder Wave-Amnesia-Flash-Double Team-Signal Beam-Ingrain-Frustration-Attract-Energy Ball-Hidden Power-Round-Substitute-Draining Kiss, 
Shiinotic, Illuminating Pokémon, マシェード, Mashade, #0756, https://archives.bulbagarden.net/wiki/Category:Shiinotic, Grass, Fairy, Illuminate, Effect Spore, Rain Dish, 60, 45, 80, 90, 100, 30, Pollen Puff-Dream Eater-Strength Sap-Sleep Talk-Grass Knot-Magic Coat-Solar Beam-Toxic-Worry Seed-Moonblast-Rest-Facade-Sunny Day-Absorb-Seed Bomb-Poison Powder-Light Screen-Astonish-Swagger-Rain Dance-Drain Punch-Stun Spore-Wonder Room-Dazzling Gleam-Magic Room-Leech Seed-Return-Recycle-Synthesis-Sleep Powder-Giga Drain-Weather Ball-Spotlight-Safeguard-Moonlight-Giga Impact-Spore-Confide-Growth-Snore-Sludge Bomb-Confuse Ray-Endure-Charge Beam-Hyper Beam-Nature Power-Protect-Mega Drain-After You-Thunder Wave-Amnesia-Flash-Double Team-Signal Beam-Ingrain-Frustration-Attract-Energy Ball-Hidden Power-Round-Substitute-Draining Kiss, 
Salandit, Toxic Lizard Pokémon, ヤトウモリ, Yatoumori, #0757, https://archives.bulbagarden.net/wiki/Category:Salandit, Poison, Fire, Corrosion, None, Oblivious, 48, 44, 40, 71, 40, 77, Acid Spray-Flare Blitz-Fling-Sleep Talk-Take Down-Burning Jealousy-Flamethrower-Sweet Scent-Toxic-Heat Wave-Skitter Smack-Tera Blast-Rest-Facade-Scale Shot-Overheat-Dragon Pulse-Sand Attack-Sunny Day-Will-O-Wisp-Scratch-Fire Blast-Taunt-Trailblaze-Dragon Claw-Toxic Spikes-Helping Hand-Mud-Slap-Nasty Plot-Sludge Wave-Agility-Swift-Fake Out-Fire Fang-Foul Play-Temper Flare-Sludge Bomb-Endure-Scary Face-Flame Charge-Protect-Shadow Claw-Leech Life-Poison Gas-Substitute-Endeavor-Gunk Shot-Thunder Wave-Smog-Incinerate-Poison Tail-Poison Jab-Poison Fang-Thief-Knock Off-Belch-Venoshock-Ember, 
Salazzle, Toxic Lizard Pokémon, エンニュート, Ennewt, #0758, https://archives.bulbagarden.net/wiki/Category:Salazzle, Poison, Fire, Corrosion, None, Oblivious, 68, 64, 60, 111, 60, 117, Acid Spray-Flare Blitz-Fling-Sleep Talk-Take Down-Burning Jealousy-Flamethrower-Sweet Scent-Toxic-Heat Wave-Skitter Smack-Tera Blast-Dragon Dance-Rest-Facade-Scale Shot-Overheat-Dragon Pulse-Sand Attack-Sunny Day-Fake Tears-Swagger-Scratch-Will-O-Wisp-Fire Blast-Hyper Voice-Taunt-Trailblaze-Dragon Claw-Toxic Spikes-Helping Hand-Mud-Slap-Nasty Plot-Body Slam-Sludge Wave-Agility-Swift-Giga Impact-Pound-Breaking Swipe-Fake Out-Fire Fang-Foul Play-Temper Flare-Encore-Sludge Bomb-Endure-Scary Face-Hyper Beam-Flame Charge-Protect-Disable-Shadow Claw-Leech Life-Poison Gas-Substitute-Fire Lash-Endeavor-Gunk Shot-Thunder Wave-Dragon Cheer-Torment-Smog-Incinerate-Acrobatics-Poison Tail-Dragon Tail-Poison Jab-Poison Fang-Thief-Knock Off-Belch-Venoshock-Ember, 
